web-scraper-order,web-scraper-start-url,news
"1723041898-1","https://www.nbe.com.eg/NBE/E/#/AR/ProductDetails?inParams=%7B%22CategoryID%22%3A%22NewsCat1ID%22%2C%22ProductID%22%3A%22%D8%AA%D9%86%D9%88%D9%8A%D9%87%20%D8%B9%D9%86%20%D8%A8%D8%B7%D8%A7%D9%82%D8%A7%D8%AA%20%D8%B4%D9%87%D8%A7%D8%AF%D8%A7%D8%AA%20%D8%A7%D9%84%D8%A7%D8%B3%D8%AA%D8%AB%D9%85%D8%A7%D8%B1%20%D8%A7%D9%84%D9%85%D8%AF%D9%81%D9%88%D8%B9%D8%A9%20%D9%85%D9%82%D8%AF%D9%85%D9%8B%D8%A7_18776%22%7D","السادة عملاء مصرفنا حاملي بطاقات شهادات الاستثمار المدفوعة مقدمًا
يرجى العلم أنه تم إيقاف التعامل بالبطاقة الخاصة بكم اعتبارًا من 1 مايو 2024
مع العلم بأنه سيتم اتخاذ الإجراءات التالية: -
 حال وجود حساب بالعملة المحلية لديكم طرف مصرفنا؛ سيتم تحويل رصيد البطاقة إلى الحساب، مع إضافة العوائد المستقبلية الخاصة بالشهادات إلى الحساب.
    حال عدم وجود أي حساب بالعملة المحلية لديكم طرف مصرفنا؛ سيتم فتح حساب ذو طبيعة خاصة بمعرفة مصرفنا لإضافة العوائد المستقبلية الخاصة بالشهادات، لذا برجاء التوجه لأقرب فرع لاستيفاء بيانات فتح حساب شخصي جديد."
